{
  "accepted_identities": [
    {
      "model": "copilot-default",
      "run_attempt": 1,
      "stage": "analysis",
      "week": "2026-W34",
      "workflow_run_id": "32657778470"
    },
    {
      "model": "copilot-default",
      "run_attempt": 1,
      "stage": "analysis",
      "week": "2026-W35",
      "workflow_run_id": "32680979082"
    },
    {
      "model": "copilot-default",
      "run_attempt": 1,
      "stage": "analysis",
      "week": "2026-W36",
      "workflow_run_id": "33359840392"
    },
    {
      "model": "copilot-default",
      "run_attempt": 1,
      "stage": "analysis",
      "week": "2026-W37",
      "workflow_run_id": "34082521901"
    },
    {
      "model": "gpt-5.6-sol",
      "run_attempt": 1,
      "stage": "analysis",
      "week": "2026-W38",
      "workflow_run_id": "34806779896"
    },
    {
      "model": "gpt-5.6-sol",
      "run_attempt": 1,
      "stage": "analysis",
      "week": "2026-W39",
      "workflow_run_id": "35561779454"
    },
    {
      "model": "gpt-5.6-sol",
      "run_attempt": 1,
      "stage": "analysis",
      "week": "2026-W40",
      "workflow_run_id": "36383884999"
    },
    {
      "model": "gpt-5.6-sol",
      "run_attempt": 1,
      "stage": "analysis",
      "week": "2026-W41",
      "workflow_run_id": "37267262375"
    },
    {
      "model": "gpt-5.6-sol",
      "run_attempt": 1,
      "stage": "analysis",
      "week": "2026-W42",
      "workflow_run_id": "38208941107"
    }
  ],
  "covered_period": {
    "end": "2026-W42",
    "latest_record_at": "2026-10-12T05:45:26Z",
    "start": "2026-W34"
  },
  "currency": "USD",
  "exclusions": {
    "legacy_unidentified": 6,
    "model_none": 0,
    "superseded_attempts": 0
  },
  "generated_at": "2026-10-12T05:45:26Z",
  "pricing_basis": "scripts.track_token_usage.MODEL_PRICING_USD_PER_MILLION",
  "provenance": {
    "ledger": "data/metrics/token-usage.jsonl",
    "legacy_policy": "exclude-unidentified",
    "maximum_age_days": 30
  },
  "reconciliation": {
    "accepted_records": 9,
    "billable_records": 9,
    "input_records": 15,
    "status": "reconciled"
  },
  "schema_version": "1.0.0",
  "totals": {
    "cost": 1.29633,
    "input_tokens": 227122,
    "output_tokens": 27560
  }
}
